{
  "schema_version": "1.1",
  "query_incident_id": "inc_current_mastercard_uncertain_002",
  "memory_status": "MATCH_FOUND",
  "matches": [
    {
      "incident_id": "INC-HIST-002D-MASTERCARD",
      "occurred_at": "2026-08-27T14:02:00Z",
      "confirmation": "HUMAN_CONFIRMED",
      "structured_score": 0.84,
      "semantic_score": 0.79,
      "matching_factors": ["country", "card_brand", "decline_profile", "latency_shape"],
      "different_factors": ["provider_scope", "sample_size"],
      "confirmed_cause": "PROVIDER_DEGRADATION",
      "prior_playbook_id": "PB-PROVIDER-DEGRADATION-001",
      "evidence_ids": ["evd_prior_confirmed_uncertain"]
    }
  ],
  "retrieval_trace": {
    "cypher_filter": "country = 'BR' AND card_brand = 'MASTERCARD' AND confirmation = 'HUMAN_CONFIRMED'",
    "candidate_count": 2,
    "embedding_model": "text-embedding-3-small",
    "index_version": "incident-memory-v1",
    "fallback_used": false
  },
  "correlation_id": "corr_inc_uncertain_002"
}
